userName,score,content
A Google user,4,"this has been a great app! I even paid for the max subscription, but there are some minor things that differ between the desktop web app and the mobile app. using the mobile is great for doing practice while out and about. I would recommend using mimo for learning to code if you're new."
A Google user,5,this is too good
A Google user,5,Great app
A Google user,5,"really good and helps you learn, I think Pro subscription is worth it but mimo max is not but udu"
A Google user,5,very nice learning platform.
A Google user,5,love the coding experience
A Google user,4,Easier to learn for every interested coding person.... I like this app
A Google user,5,Learned one free coding course and had MySpace in my youth - I was convinced I could code. But this app makes learning easy and accessible.
A Google user,5,When I find way to learn coding on android phone on online i find mimo and I give it try and i find it mimo best app for learning
A Google user,4,This is very useful and safe.
A Google user,3,very easy to use
A Google user,5,😃
A Google user,5,great for learning code
A Google user,4,"just a beginner but I think I'm getting a hang of it, though it seems though, the design is learner- friendly"
A Google user,5,I don't know I think I'm learning
A Google user,5,coding is becoming my favorite thing
A Google user,4,Pretty Cool!
A Google user,5,"exceptional coding app, easy to learn. But I think the English in it is somehow difficult for beginners"
A Google user,5,top
A Google user,5,good for everyone 👍
A Google user,1,"SCAM. I cancelled my subscription many months ago, and they've taken 250 pounds out of my bank account. Don't put any of your card details in the app as they'll take money from you even when you've cancelled your subscription 6 months in advance and haven't used it at all."
A Google user,5,Can you add c language and c++ course in mimo app
A Google user,5,good app
A Google user,5,Good
A Google user,5,It's kinda worthy app to learn the basics of coding. I suggest i very much to all of them who wants to learn about coding.
A Google user,5,Easy to learn
A Google user,5,super
A Google user,5,fun way to learn
A Google user,1,"Pathetic and expensive. It's an app that offers a few days of free service, then charges you €50+ for a year's subscription, with no reminders. I despise this practise for a start, but then the learning material is very, very slow. It suggests that it will teach you AI and professional coding. This is nonsense. The game like method of training is incredibly slow and very, very basic. Seriously, just get a Udemy course for ~€20. You'll have it for life, and leave this for the suckers."
A Google user,5,A very very good app for learning coding
A Google user,1,"Top basic,couldnt seem to skip over the basics either"
A Google user,5,the best coding app to learn coding on mobile and star earning
A Google user,5,thought me to master variables and printing
A Google user,4,"if you have enough money for subscription, then this is a great app"
A Google user,5,so easy and slick to use.
A Google user,5,"ajuda muito, recomendo"
A Google user,5,I love this app. learn is made Simple
A Google user,5,"This app has a fun way of learning code. Sometimes when I put in something that works, I lose a heart. It turns out the solution needs to be small version of code to be correct."
A Google user,1,"Why do you need to pay to complete the course? Isn't that what learning apps are for? Would have rated 4-5 stars, but needing to buy premium to even finish the courses is insane. Take a more Duolingo approach and allow the user to complete the courses with ads and extra stuff and no ads in premium."
A Google user,5,"awesome, feels like a pro in minutes"
A Google user,5,"Okay, time to write my review. Holly molly. This app is amazing! I've been learning to program on it for the last month and I've managed to make a site that shows Hello, World! with a button linked to my facebook profile with some simple styling after two weeks. Context: I had zero programing knowledge. It's easy to understand, has all the key knowledge stuffed into interactive learning enviroment and I really had no idea how fun it is to study like this 😁 100/10 🎉"
A Google user,5,pretty good got the trial. planning to cancel but so far im getting my moneys worth so might just keep it
A Google user,5,Helpful
A Google user,5,Hacker x having good skill in coding.
A Google user,5,great
A Google user,5,wow
A Google user,3,"I wanted to learn,but you HAVE to sign up for a free trial,it looked fun.but no"
A Google user,5,"excelente aplicación la recomiendo, es muy buena para aprender a programar."
A Google user,5,easy to learn and worth the price for how much it teaches and certifies.
A Google user,5,great app reminds me of Duolingo
A Google user,2,"This app is bad, i asked to learn game programing and now im learning how to make my own useless website, plus the images dont work at all, its still quite fun so i rate it a 2/5, i only recommend if your doing it for fun because you definitely cant become a professional from this"
A Google user,5,"its really good, like duolingo for coding"
A Google user,5,"it is a very good app,it serves as practice and also gaming. It is quite fun."
A Google user,4,good for learning but we should pay money for certificates
A Google user,5,it's a very nice app for beginners and also experts
A Google user,5,helping me more with code
A Google user,4,It is really useful and easy to understand.
A Google user,4,"I think the app is very good. One issue i hit is when I'm typing an answer, often the cursor jumps to the beginning of the code and it starts typing there. Otherwise, I find a decent amount of the practice or class work repetitive."
A Google user,2,"When it works, it's incredible. However the Android version has an error where the ""practice"" section doesn't work. I have to use my iPhone to use the full functionality of the app."
A Google user,4,"progressing well for me so, I think everyone should try it if they want to learn html"
A Google user,5,it's a fantastic app that teaches you how code easily using Python.
A Google user,5,the app is really interesting for programers
A Google user,5,I like the app very much because it's teaching me how to code/I.T also it's explaining for a better understanding
A Google user,5,is good and very good 😊
A Google user,5,no word just try
A Google user,5,Very helpful. For Beginners
A Google user,5,It deserver 5 starts but only if they respond to our questions... Next time max rating.. I did rate mimo after this practice feature added.. Thanks for unlimited hearts in this section.... 💕💕❤️❤️❤️❤️Now I can understand without losing hearts
A Google user,3,I need to skip some basics
A Google user,5,brilliant
A Google user,5,"Really fun way to learn coding, especially with the ranking system in place makes it feel like a fun competition."
A Google user,5,this is very easy but the problem is this app want money
A Google user,4,Easy to use and useful for children and adults as well. Thank you. mimo
A Google user,5,it is to amazing
A Google user,5,makes me excited to learn the software to have a great career in computer programming.
A Google user,5,Educational for my son to learn coding
A Google user,5,nice
A Google user,5,This app makes learning to code so simple and is super easy to use.
A Google user,5,educational
A Google user,5,you have to try even encourages you to achieve your goals and never let's you fail there is even no such thing as failing in mimo because you will achieve.
A Google user,4,hasta el momento es una buena app
A Google user,5,i love it so much. will try the premium
A Google user,5,"this game is challenging, rewarding, educational & addictive - I'm only on my 3rd lesson & feel there's potential to building a website using HTML"
A Google user,5,"By far, the best app to learn how to code. Very engaging and although it's repetitive, it reinforces your learning very well! Definitely worth the price!"
A Google user,5,Super Easy to learn for all those Newbie. Thank you 🙏
A Google user,5,it's fun and easy to learn. the app gives simple instructions and makes it fun and enjoyable to learn to code
A Google user,5,"This is the best for me, I'm a high school student and I want to get the course 'Computer and science' so that's why I tried this app and this is a very good start for a beginner like me, and I can learn offline! 😍🌹"
A Google user,5,it's very nice to learn computer languages and etc
A Google user,5,a good app for learn coding but one thing they have to give us a practice web page to conquer our skills
A Google user,4,Best app to learn programming as a beginner
A Google user,5,I am a high schooler who is not very into coding. But I think it looks cool and find it interesting how it works. The UI is so cool! And you can access SO MANY things for absolutely free! It is really very good who want to learn coding just for fun!
A Google user,4,"I love using this app to learn Python. It's become part of my daily activities. The lessons are structured and easy to follow. Even as a slow learner, I am able to grasp the concepts and reflect on my learning. It's a very interactive and user-friendly app and I highly recommend it to newbies, like myself. Please add more details to the Glossary section, especially for Python?"
A Google user,5,it is very helpful app to learn
A Google user,5,"Very great, i learn alot in just a day! VERY RECOMMENDED!!!"
A Google user,5,im liking it
A Google user,1,Shouldn't have ti pay
A Google user,3,Educational
A Google user,5,very good to learn coding. very interesting
A Google user,5,just perfect without the pro but it would surpassed it if you have pro
A Google user,5,amazing 🤺👏👏
A Google user,5,I love it 😊😊😊😊
A Google user,5,"it's nice 👍, the app is the best for beginners"
A Google user,5,Educational
A Google user,5,Very useful and simple tutorials
A Google user,5,I will highly recommend this app for those who will like to code because the built-in lessons are great and understandable
A Google user,5,I like 👍 👌 ♥️ 😋 ❤️ 😍
A Google user,4,طااااااااااارش
A Google user,5,I love it
A Google user,5,"just a masterpiece, WOW!"
A Google user,5,Best App For Coding
A Google user,5,It's a good coding app for students.I like it very much 🙂 thanks for making this app
A Google user,5,where has this app been all of my life 🥰
A Google user,4,Edureka
A Google user,5,Killa app
A Google user,4,extraordinary app I ever seen
A Google user,4,this is a good app for beginners
A Google user,5,very intuitive and user friendly
A Google user,4,This is most interesting App I have never seen to learn coding
A Google user,5,Best app for self-learning in programming for beginners
A Google user,5,use ful
A Google user,5,It's very fun and interesting to learn coding for a beginner like me who doesn't have any experience and knowledge in coding. I really enjoyed learning the coding and it was easy to understand.
A Google user,5,it's cool
A Google user,5,Just one word Best application for learning programing.
A Google user,4,"It's a nice app. Gives a lot for people to learn. Would definitely recommend. The only problem is that it has the most important feature - desktop projects, locked behind the heavy pay wall. And it is not possible for a student like me to purchase something like that just for desktop projects. So yeah. I'm trying to manage by doing that stuff by myself as much as I can, but I can clearly see that I'm definitely lacking out. I'd be grateful if they kept Desktop projects as separate pay option."
A Google user,5,☄️
A Google user,5,best
A Google user,1,Charges money. Not free. There are free ways to learn to code.
A Google user,4,"pretty fun way to learn coding, similar to Duolingo but more educational (very subjective opinion here.)"
A Google user,4,I never believed I could learn coding with my mobile phone I thought you can only learn it on a computer system 🖥️ But thanks to this app It's great
A Google user,5,Nice for learning to code for fun!
A Google user,5,Best of its kind
A Google user,5,very good
A Google user,1,"Mimo has refused to return my money back two weeks now, with very bad customer service. Mimo app find it difficult to refund your money back you. 👎👎👎👎"
A Google user,5,good
A Google user,5,simple to understand very informational
A Google user,5,it's a really nice app for learning.
A Google user,5,Duolingo but for tech yes please
A Google user,4,ok ok
A Google user,3,decent
A Google user,5,I love this app it shows all the importance of coding but sometimes it is hard to understand but overall it's a brilliant app 👍🏻
A Google user,5,Best for beginners learning coding !
A Google user,5,thank you
A Google user,5,"Wow,it's impressive"
A Google user,5,Very good application
A Google user,5,Practice view is not working... showing matrix glitch..
A Google user,4,this is too easy to learn coding . it totally like fun
A Google user,5,The app is great Really reliable and efficient
A Google user,5,more informative
A Google user,5,"I have to say, it's really helpful"
A Google user,5,It's a dope app to learn
A Google user,5,good
A Google user,5,"This app is amazing!!! Even if you don't have premium , mimo does the best for you for free!!"
A Google user,5,tqs a lot
A Google user,5,Very good app for learning and practicing your code on the go. It's just missing a Java learning path to be perfect.
A Google user,5,it's a great app so far
A Google user,5,God I kid u not this app has taught me everything from basics to advance with such ease and excitement!
A Google user,4,nice at some point ur told what to do they are ready to follow u to the end even if u fail
A Google user,5,very good app
A Google user,3,Being as it was made using ai it's pretty good a couple issues with it not recognizing the answer and connection issues but I'm enjoying myself non the less and it's taught me more in a week than 6 months at full sail so yea
A Google user,5,Good
A Google user,5,very good
A Google user,2,There are many glitches. I found in last 2 days firstefole my winning stone are not count. also the prectice set is not available it says (An unexpected error happened) please fix that I love this application it helps me to build logic and learning new things
A Google user,5,it is such a wonderful app
A Google user,5,i love this app It's giving 😍😍😍
A Google user,5,Best App for easily learning to code. Must Download.
A Google user,3,"Really good app. But when a i want to select the practice section, it keeps saying there's an unexpected error abd something went wrong. It's been two days now and i don't know what to do"
A Google user,5,Very nice to start i am 14 and I get all the starting codes and tags with this app try 10 to 20 min every day try it now It is a really good app not under pressure to review
A Google user,5,good 😊
A Google user,4,😳😲
A Google user,5,prefecto
A Google user,5,amazing simply amazing I knew nothing about coding before this app it amazing
A Google user,5,So easy to understand make it pure to understand
A Google user,5,really good guidance and nice explaining appreciated to the developer 🫡
A Google user,5,very nice app to learn coding
A Google user,5,Bestest coding learning language I ever use
A Google user,5,this app is really very useful and understandable 👌
A Google user,5,"I generally have no knowledge of code and development, but this app is helping tremendously!"
A Google user,5,Best app no adds at all 🫡
A Google user,5,"Not a ""Tech"" kind of person but this app helps to make sense of how it works"
A Google user,5,Best For Beginners from 0 to 1 level
A Google user,5,Mimo is the best app for starting coding. Anybody can learn different types of coding from here. It is so fun and enjoyable to learn. Even students who're interested in coding can also acquire knowledge from this app from their beginning as if they would take advantage in their college and university life. {Start to learn coding with Mimo🫶🏻}
A Google user,5,This app I were help full for beginners how I have see It use for best learning for new coders Best app I have seen for coding
A Google user,5,The coding skill Before & After is astonishing!
A Google user,4,quite a great app for learning programming and i have used to it for about 3 months now with no problem and smooth learning but the web app is almost a wholy paid for app
A Google user,5,The best teacher!!!
A Google user,5,"I like how interactive it is, I just got it but so far it's great. kind of reminds me of Duolingo. Will update though"
A Google user,5,this app is very good and I recommend everyone to try it
A Google user,1,Sucks offers everything except Java the one programming language I wanted to learn
A Google user,5,"saying it all, I found these app very useful to me as a beginner.. 5 star rated"
A Google user,3,it a great app
A Google user,4,It actually keeps me busy and helps me stay together.
A Google user,5,this app is amazing for learning new things
A Google user,5,it's a fantastic app
A Google user,5,It's too good
A Google user,5,very helpful 👍🏻😌
A Google user,5,good
A Google user,4,"mimo makes teaching very easy with its survey course. I highly recommend using mimo for all beginners willing to get good at website developing, coding and others. Ultimately, don't forget to write some where for more experience and practice. I wish you the best in your journey but remember that the magic u a looking for is here"
A Google user,5,i understand more knowledge thanks
A Google user,5,simple and easy to learn
A Google user,5,extremely knowledgeable app.
A Google user,4,please select beginner level
A Google user,5,this app is incredible and i love it.
A Google user,4,I like it. it said I ## years old it one year off but for the add it self it good but not the money part that why I gave it a 4 but not 5 😔😐
A Google user,3,wisch the certificates could be free for learners
A Google user,5,very great teacher
A Google user,5,"It's a really good coding, impressive 😄"
A Google user,5,dope!
A Google user,5,"love it, learning slowly and small bite size is perfect for me."
A Google user,5,Excellent
A Google user,5,"it teaches way better than some well known paid courses, it teaches us in that way we don't forget it and also it becomes too easy to learn! I was very new to programming and didn't know anything but this app taught me in such a way it felt so easy to learn and make my own program. I am so glad that I found this app!"
A Google user,5,Really good for beginners as well as those who know about coding
A Google user,5,"Great, easy to follow practice."
A Google user,5,🥰
A Google user,5,yes very good
A Google user,5,"learning tool = ""awesome"""
A Google user,5,love this app it's easy to be professional developer by this app
A Google user,5,"Rest of the app app is incredible and awesome and so easy to learn with just like Duolingo which is the best app for learning Human languages.But I would like to request the developers to add a career path (Game Development) and three more languages (C,C++ and C#).I shall be very thankful to the developers if they did this because it would not only help me but a lot of other people and themselves too.Other people will get to have more choices and for the developers, they will gain more downloads"
A Google user,5,The best code learning app ever!
A Google user,5,"Great application mimo = ""phython"" print = ""mimo"" output- (phython)"
A Google user,5,please add more heart to make mistakes and understand
A Google user,5,very nice app (:
A Google user,1,I Don't want to learn HTML I just want to learn Java Script and Python so how could I choose them?
A Google user,5,Great app. Looking forward to learn better here
A Google user,5,best application for full fresher recommendation from commerce students
A Google user,5,excellent 👌👍
A Google user,5,"Simple, efficient, exactly what we want"
A Google user,5,super app for learning coding
A Google user,5,Usually I don't review about apps I am using in my daily routine but after downloading mimo I am so happy because I always thought that coding is so much expensive and no one will teach you in free . And it's very hard but after downloading mimo I can understand why developers give you free course. You can buy their monthly subscription. But if you don't have money you can learn for free. Thanku mimo . Love you from my heart ❤️❤️❤️
A Google user,5,Best App!!!!!!
A Google user,5,best
A Google user,5,its really helpful especially without computer
A Google user,5,easy way to learn
A Google user,5,"great so far! I have no complaints but a recommendation-maybe you could make it so you can skip lessons by taking a little assessment/quiz because I've been doing coding for a year, so I'm a but ahead of the first lessons. or maybe a placement quiz/test thingy? great app!"
A Google user,5,awesome
A Google user,5,what a fun way to learn
A Google user,5,just
A Google user,5,day 1. Will report back on day 14. firstly I need a pay monthly option or this will be a 1 star flop
A Google user,3,"I recently downloaded the app and I've been loving it so far. I just have a problem with the practice section. It always says error when I try to practice, I've been having this problem for a few days now. This prevents me from completing my Intro course and moving to the next one. I would appreciate it if this issue was fixed. I love the app and I would like to continue to use it."
A Google user,5,"It's amazing with mimo so educatable, which can make you understand the skills coding"
A Google user,4,It is a nice platform for coding even for beginners like myself. The classes are simplified to help me understand better
A Google user,5,"A fun free way to learn coding, turning it into a great career opportunity."
A Google user,5,easy to learn how to code
A Google user,5,fantastic app..helps learning from scratch
A Google user,5,Learning quickly even though I have no experience in coding
A Google user,5,awesome app to learn computer language.
A Google user,5,it's good
A Google user,4,Will your add another languages? For example C# ?
A Google user,5,thx for this app It is so useful and easy to use but i just want infinity trays
A Google user,5,good for python
A Google user,4,"This a great app for someone who is interested to dig in to programming and I want to give a big thanks to mimo creators because they made the app so easily detailed I am 14 years old but now I kinda understand how and whan to use python, Java, Javascript etc.. But I'd love if yall can make a programming app for making projects thanks with regards owethu"
A Google user,5,A very beginner-friendly app to help you start your journey in coding. The app helps you learn with simple yet fun exercises that remove any intimidation that you may have initially had about coding.
A Google user,5,Cool waY to learn. coding
A Google user,5,the best learning app ever. it's beyond perfect.
A Google user,5,It's easy to understand
A Google user,5,"Wow this app is really good for beginners and even to those who have experience. Im currently learning HTML and CSS, but I want to learn python too. Can I possibly do it in this app? I don't know how, please help"
A Google user,5,Good app
A Google user,5,best coding app
A Google user,5,best app for learning coding for beginners
A Google user,4,"Despite being a 1 to 1 copy of duolingo but it's coding it is well made, after only finishing 3 levels I can make a decent website and its cool if your new to coding and wanna get out of tutorial he'll then this is a good app for that"
A Google user,4,i understand the foundation of programming better now
A Google user,4,awesome.
A Google user,5,nice application
A Google user,4,amazing
A Google user,1,bad bad bad extremely bad bad worst
A Google user,5,Goat Of Coding Apps
A Google user,1,very bad
A Google user,4,"it is the best app to learn,practise and write codes but I am a child so I don't able to pay to this app and this app request money to various things like subscription and certificate ."
A Google user,5,Better than Duolingo.
A Google user,5,Amazing
A Google user,5,the UI UX is amazing. beginner friendly and very motivating. love it
A Google user,5,good
A Google user,5,nice app 👍🏻
A Google user,4,This is wonderfull
A Google user,5,Fun way to learn and lots of practice questions included
A Google user,5,I have learned a ton so far
A Google user,3,there is paid certificate this is because I give 3 stars
A Google user,5,Its good
A Google user,5,Good
A Google user,5,love it. Has an user-friendly and interactive way of learning that makes it perfect for beginners.
A Google user,5,This is very interesting!
A Google user,5,Excellent app
A Google user,5,Great app
A Google user,5,I wish I have access to banking 😞
A Google user,5,This is awesome and informative for a newbie to coding like me and it's fun almost like playing a game
A Google user,5,it is the doulingo of coding
A Google user,5,epic for now
A Google user,5,It a good app
A Google user,5,best app for learning computer language.
A Google user,5,I'll love to know more in this teaching manner
A Google user,5,Fantastic experience 👏 👌
A Google user,4,its good a well thought app overall
A Google user,5,I love it as it has many features I am a coder 💪
A Google user,3,"If it was free, it would be a great software"
A Google user,5,very good to know
A Google user,5,It's fun. Not sure if I'm really learning much though as no real coder uses a phone to code.
A Google user,5,5star!!!
A Google user,5,Best and coolest 😎 app coding with examples.
A Google user,4,nice and best way to start learning programming easily 4 Beginners and more effective and efficient also
