userName,score,content
A Google user,5,amazing app to learn for beginners specially who does not want to read much
A Google user,5,its amazing
A Google user,5,good coding
A Google user,5,very reliable to learn on
A Google user,4,👍
A Google user,5,good app for learning
A Google user,4,good 👍
A Google user,5,wonderful 😊
A Google user,4,great app
A Google user,5,very nice for beginners who is learning basic to advanced python coding.
A Google user,5,Very good app
A Google user,5,😃
A Google user,4,this is the best for beginners
A Google user,5,Easy to learn
A Google user,5,Best coding app
A Google user,5,Nice app
A Google user,4,"I feel like there is lot of wasted potential with max subscription. The point where you have to go to web to code a project but instead of coding you get asked for upgrade from pro to MAX. Also I would change a type of questions in the end of each lesson to make a code by yourself instead of just selecting word by word. Anyway at first it was like 6/5 stars, but after almost a week of using it. I can see some flaws"
A Google user,5,very nice
A Google user,4,it a great app for learning and opportunity
A Google user,5,Excellent app
A Google user,5,Omo ! this is my first time coding an the app really explained it in it's simplest form. I love it 💪
A Google user,5,good
A Google user,5,this app is amazing and easy to understand
A Google user,4,this app really helps 🩵🩵🩵🩵🩵💯
A Google user,5,"i think it's a good app, haven't tried it full, i will update when i try the full courses."
A Google user,5,The best teaching platform
A Google user,5,"first I thought that coding was very difficult, but this app makes me to believe that coding is very easy"
A Google user,5,"Mimo is an excellent app for learning programming, perfect for beginners and those looking to enhance their skills. It simplifies complex topics in Python, JavaScript, and HTML, making them easy and enjoyable to learn. With short lessons and interactive exercises, it keeps users engaged and motivated. The app allows you to progress at your own pace and turns learning into a fun experience with its gamified features. Overall, it's a fantastic choice for coding enthusiasts."
A Google user,5,Great
A Google user,4,"The app is not bad, makes learning it more fun and not boring 🌚"
A Google user,5,Very fast learning.
A Google user,5,I'm only on the third level(lesson) and I've already gotten really into it! And no I'm not a bot.
A Google user,5,Very good
A Google user,5,Nice
A Google user,5,"this is an amazing app for learning programing, it is user friendly and I Love the test given after every lesson."
A Google user,5,best app to learn to code
A Google user,5,Really helps with learning
A Google user,4,Great learning tool.
A Google user,5,very nice app
A Google user,5,All time best app for programming I suggest my all friends to learn coding from legendary mimo app. Selute to mimo devloper team 🫡🫡
A Google user,5,I actually learn programming from nothing to something ❤💖💗💓💝 Thank you Mino
A Google user,5,Great full 😍👍🏽
A Google user,5,Iti is a good app to learn programming...
A Google user,4,"I bought a year subscription, little did I know they meant it would be I've at the end of the month (December). Man you gotta be on top of your game."
A Google user,3,remove hearts
A Google user,4,I actually like this app better than sololearn but this app needs money but there is free trial 1 year so I don't really mind
A Google user,4,"good for beginners, easy to understand and is kinda fun."
A Google user,4,"I've really enjoyed making codes and skills in making webpage the app is amazing,download it guys"
A Google user,1,It has worst hints Ive seen in my life it told me to add Tiktok or Instagram link I did and it showed me wrong taking all my lives just to revil me I was supost to add Instagram without a link I wouldnt recomend
A Google user,5,this is the best app to learn python program. it's fun and easy to learn and I blindly recommend this app for beginners. and it was just like duolingo.
A Google user,5,"This is super excellent app that frankly teach us coadings with our type of understanding manner, it's my opinion to this app for their outstanding performing and gestures like teaching style, and it is helpful in future if we choosing place released to compute,so it is tooo helpful app that I recommend to teach coadings bettterly."
A Google user,1,Terrible. Full of major glitches stopping progress
A Google user,4,fun & and an easy way to learn coding
A Google user,5,very good application
A Google user,5,learn with the right way 👍❤️
A Google user,5,very good
A Google user,5,this app is fun to learn. It teaches more stuff that I didn't know 😃 but I wish some stuff we could learn free and not pay for education or learning 😇😉
A Google user,3,wish it wasn't so predatory with the subscription... cool otherwise
A Google user,5,easy to use !keep it up ❤️
A Google user,5,"I'm loving it, it's quite engaging!"
A Google user,5,"No matter that u are just starting this app can help you to learn basic coding easily like way easily that no other app can, i hope that they make a version for c++ too coz its way easier to learn on mimo, i love mimo."
A Google user,5,"Mimo is awesome, l just started coding with my phone."
A Google user,3,Before asking the question about the topic first you can explain it was better easy to learn as fast as
A Google user,5,It's makes it easy to know that concept and basics of coding
A Google user,5,I like the application and it's so fast and teaching method is good
A Google user,5,great
A Google user,5,It's a very good app to learn programming.... but please add C++
A Google user,5,good learning app
A Google user,5,great learning experience
A Google user,5,It's a lot of fun like playing a game
A Google user,3,"Mimo is a great app for learning codes for beginners, experienced code developers, or code designers."
A Google user,5,"I advise everyone who wants to learn programming to download this program, it is very wonderful. 🙌🏻"
A Google user,3,Nice 👍 I really enjoyed it 😀 but What I don't get is can I learn python when I'm learning HTML or after I finished learning HTML?
A Google user,5,so far so cool... I'll update if I can write fluent Python when I'm finished...
A Google user,3,great application for learners i'm so happy
A Google user,5,"this help so so MUCH I really like it.Thank you so much for this,developers"
A Google user,4,"So let me start by saying that out of all the coding tutorial apps I've tried this is the best one. That being said, there are a few glitches that I'd very much like to be sorted out. For one, when in lessons the cursor likes to randomly jump to the beginning of the first line, which is REALLY annoying. Secondly, the app seems to struggle to sync with the desktop version which sucks cause I paid for that. Lastly, you can only check coins and leaderboard on the mobile app =[ still, great app"
A Google user,5,fun. i even paid for it!
A Google user,5,tiny yet power app for learners and intermediate skill developers.
A Google user,4,until now its good to me
A Google user,5,I love this app! Very easy to understand and I hardly know a thing about computers. Strongly recommend if you would like to learn!
A Google user,5,Preety helpful
A Google user,5,"honestly, not bad it feels a bit like Duolingo but for learning some base code."
A Google user,4,pretty good
A Google user,5,like Duolingo but without an angry owl 🦉
A Google user,5,nice experience so far
A Google user,5,"Great app, I love it!"
A Google user,5,No one has made complex learning as simple. I salute you Gentlepeople 🙏🏼
A Google user,5,I like it ☺️💕
A Google user,5,good
A Google user,4,I like the app very much but the renewal of hearts is too slow something 3 hours . So please improve that and make it faster Edit : I loved the new updates of the practicing session
A Google user,3,Still needs polishing for the cross-platform progression.. you can't really go back and forth between mobile and desktop version as any practice/projects you do on desktop arent marked as completed on the mobile version. Quite frustrating cause I can't start the next chapter when I'm not on my computer without completing those on mobile as well
A Google user,5,"good, but we can choose another programing language if we already pick something"
A Google user,5,"Very helpful! I'm a young learner and am very stupid, but this is just amazing! Best app for coding I've used by far."
A Google user,5,Good
A Google user,4,good prog I like but you train hard because our life is hard
A Google user,5,A free and helpful platform to start with the basics of any programming language ! I personally found this one quite amazing 😍
A Google user,1,This people are wicked They don't want to give me my certificate
A Google user,5,tricky but achievable
A Google user,5,Very good app
A Google user,5,good
A Google user,5,it's good not boring and perfect
A Google user,5,This is a great way to learn coding. I am a beginner and I would recommend this to others for sure. It's easy to use and understand.
A Google user,4,cool app
A Google user,5,This is the best platform for beginners in coding like me!
A Google user,4,Mimo is beginner-friendly. I would recommend this app to those who wants to learn while having fun 😍
A Google user,5,great
A Google user,4,simple and enjoyable
A Google user,5,great app to learn python while having fun. It's so fun that learning just became a form of entertainment!
A Google user,4,great learning interface
A Google user,5,amazing easy to grasp concepts
A Google user,5,"I am living in HAITI,I don't know why I can't buy this course for premium version. Could anyone help me please?"
A Google user,5,Very good app you can learn coding skills very easily.
A Google user,5,"so far its a quite good experience,"
A Google user,5,I love it!!
A Google user,5,It's really great actually
A Google user,5,This is just the right thing.
A Google user,5,nice code bro
A Google user,5,awesome im learning
A Google user,5,"This app makes learning coding very easy with hands on learning, you learn as you code."
A Google user,5,"Let You Start Your Coding, With Mimo . Btw I am From にほんじん。"
A Google user,5,Amazing app! Its all getting back to my memory.
A Google user,5,"If you are a complete begginner and online tutorials don't work for you , download this app. So far I understood everything. Definitely worth it! 🔥"
A Google user,5,it's fun 😁
A Google user,5,becomes easier and more fun
A Google user,5,I'm learning
A Google user,5,"good apps, i hope i can have free full access because i'm broke and need jobs. i hope i get jobs as soon as posible as data sciencetist"
A Google user,5,good 👍
A Google user,4,"Simple, easy and understandable! That's what a beginner's need."
A Google user,5,Maybe you can add flask and django for python developers
A Google user,5,perfect app
A Google user,5,it's user friendly and very impactful
A Google user,2,i wasn't expecting to pay today it just charged me over $120 or so a d j am so a.gry I paided already now I am broke and I. a difficult sp
A Google user,5,I love the simplicity with which they teach
A Google user,3,Can have a option for family like duolingo. add more course. provide more practice questions.
A Google user,5,great
A Google user,5,A very great app I really enjoyed the lessons
A Google user,5,better than doom scrolling
A Google user,2,good
A Google user,5,It is the best app and also a great teacher for coding.
A Google user,5,"This app is perfect 😍, if you want to be a professional developer. I recommend it 😄"
A Google user,5,Great app to learn coding
A Google user,5,it's so good the questions are easy and understandable. The environment is very well made👏
A Google user,5,It's a really good program
A Google user,5,awesome
A Google user,5,IT IS VERY AWESOME APP FOR BEGINNERS
A Google user,1,good👍
A Google user,5,cool
A Google user,3,I just want to learn coding for a game I feel like developing
A Google user,5,good for scripting!
A Google user,4,I like It.
A Google user,5,"Nice i've learned far from who am i before, but my head is still confused it's still hard than i thought but it will teach you how to code just try to remember how it be done. This app is a 10/10 for me. So come on download it now"
A Google user,4,Application très cool
A Google user,5,best app to learn web designing
A Google user,5,This is good but it doesn't have c language
A Google user,5,great app
A Google user,5,Very useful!
A Google user,4,mimo got me interested in codind. mimo made learning fun.
A Google user,5,good 👍
A Google user,5,good app! I am a beginner and this create an opportunity for me to learn python in a more easy way.
A Google user,5,This is an awesome app for all the beginners to start their coding journey
A Google user,5,legend app simple to learn
A Google user,5,it is a great experience to learn coding and it certainly leaves me to take notes to use for future purposes.
A Google user,5,Best ever
A Google user,5,I am in love with mimo on my way to 100day streak
A Google user,5,very nice app
A Google user,5,very nice and perfect app for beginners thank u developer ☺️☺️
A Google user,5,it should not be paid but a very nice app I liked it very much
A Google user,3,its alright l guess
A Google user,2,Good to get some ideas but most of the testing is just wrong. Do not use if you are new to programming. It also randomly drops your streak.
A Google user,5,Very satisfying and I start loving it.🤩
A Google user,5,everyone must start at some point. this is the start u must try.
A Google user,5,bas ye agar heart vala system nahi hota to ye sbse best app hota... seriously amazing hai
A Google user,5,"makes it amusing to learn how to code! it is really hard for me to commit to things like mimo, but with the help of a friend and the way the app is structured, I think I'll be staying here for a while!"
A Google user,4,so far it's oky let see we're it takes me
A Google user,5,great experience
A Google user,4,"So far this has been the winner app for me. I've wanted to learn to code for past 10yrs. I know a ton about technology electronics etc. I always end up at a dead end bc coding will always be the next step when trying to advance in the world of ""IT"". Until now, I've always Attempted to learn in many different ways but also ended up the same more confused than when I started. This app breaks coding down into simple step by step instructions to keep you motivated instead of overwhelmed with doubt."
A Google user,5,Easy and Interesting
A Google user,5,"Best coding app, i literally learned soooooo much <33"
A Google user,4,easy coding app. love this
A Google user,4,"Otsa good app, but it feels a little slow at least for Python."
A Google user,5,"in wanting to learn coding from the beginning, it's easy to understand and learn from!"
A Google user,5,I'm begginer and I love it
A Google user,4,I personally love this app Its incredible how easy and funy to learn using it
A Google user,5,Fun way to learn code
A Google user,5,"Really interactive, covers your bases. Really helpful and opens your mind to other possibilities <3"
A Google user,4,Best app to learn coding on all devices
A Google user,5,nice
A Google user,5,easy to learn
A Google user,3,"it's wonderful.....I didn't have any idea about coding but with Mino at least now I can pick a leaf ...it has conquered my mind but now I seen that requires payment .. scared how am going to proceed yet I don't have even an account...just hand to mouth.,"
A Google user,5,thank you
A Google user,5,excellent
A Google user,5,this is the best
A Google user,5,"its good, but some is pide.Overall i like the app and enjoying it."
A Google user,5,I like it.
A Google user,5,1. Add massage options for important conversation 2.add cloud storage 3. Add note pad to write personal details of codeing which is always save and sequre their
A Google user,5,good app
A Google user,1,"I purchased a Lifetime subscription to Mimo, but they moved features I paid for into a new tier, ""Mimo Max,"" reducing my access. This bait-and-switch tactic is unethical. Support only offered a discount instead of honoring the original agreement. Beware—Mimo's ""Lifetime"" promise doesn't hold up. I can't recommend this app."
A Google user,5,best for beginners
A Google user,2,fi🙏🙏🙏🙏
A Google user,5,noice
A Google user,4,This is the best coding app but it will be better if u can reduce the amount of time to wait before gaining a heat like wait for 45mins. Pls reduce the time from 3hrs to like 45mins or 1hr max
A Google user,5,I have been half using this app for 7 years now but somehow i feel very ready to be serious about learning how to code
A Google user,5,nice
A Google user,3,Losing progress when the app should be running in the background is not fun.
A Google user,5,it's actually good
A Google user,4,I 👍 it!
A Google user,4,I love it but......
A Google user,5,great app start teaching you from the basic. recommended for beginners.
A Google user,5,"I am speechless, this app is user friendly as hell."
A Google user,5,Mimo is a good start for beginners try it.
A Google user,5,it's good
A Google user,3,"it's been better if it does not have that ""Pro"" thing."
A Google user,4,good
A Google user,5,It's a lot like Duolingo but for Coding Languages
A Google user,5,so fun and easier to learn using this app. vs all the other apps out there.!
A Google user,5,it fun
A Google user,5,Great app on how to learn coding
A Google user,4,"It's a very good app that help starters to develop their passion in coding and to acquire a lot of knowledge about the courses like back-end developing,hacking and a whole lot."
A Google user,5,Great for coder
A Google user,5,MY GOAL- LEARN ALL LANGUAGES THAT'S NECESSARY ✨
A Google user,5,"Mimo is the best thing. i knew nothing about coding, but now i know so much more. i truly love Mimo"
A Google user,5,"For a newbie like me, this is amazing and presented very well in a easy to learn structure, keep adding more to the free plan, im more than happy to have adds 😁"
A Google user,5,it's good and easy best for bigginers
A Google user,4,good for beginners
A Google user,5,so good
A Google user,5,This aap is so good and much helpful
A Google user,5,"it's really cool app, am able to learn more with the interactive games and problems, best app for beginers"
A Google user,5,nice
A Google user,5,Duolingo for coding!
A Google user,5,amazing
A Google user,4,really interesting and easy learning
A Google user,4,"I dunno why people give it such bad ratings, it's a great app. Perfect for practicing for free, you really don't need the subscriptions at least not right away. I wouldn't say it's good for beginners though cuz it doesn't really explain why things are important. It could be a little more detailed for people who need more of an explanation."
A Google user,5,It's like duolingo but it's coding instead. I actually enjoy logging in to learn because it's easy and decently short depending on your course. 10/10
A Google user,5,I Love it
A Google user,5,"this app is good, make me learn coding in earlier age"
A Google user,5,"I always wanted to code with HTML/Javascript, or any other traditional coding language. But every time I looked at it, it was so overwhelming and scary. Once I found this app, it started to make a lot more sense. Easy to understand and quick lessons. Structure of the app itself is very similar to Duolingo."
A Google user,4,it's really good for beginners
A Google user,4,nice application for learn code
A Google user,5,it's a great app and it makes you understand things step by step
A Google user,5,ayuda con los fundamentos bastante al inicio
A Google user,5,👍
A Google user,5,it's really good coz I get step by step procedures since I am a beginner
A Google user,5,op than you think it's like a game and addictive and it helps what u need than this mimo is the absolute goat
A Google user,5,"Not boring, awesome UI, Learn multiple languages in glossary, Guides in learning, Comprehensive teachings even a dumba$$ will understand 5★ real"
A Google user,5,good
A Google user,5,"Absolute wonderful customer service! Friendly, fast helpful and generous. I wish, more companies were like this. I hope you guys keep it up! I can't say too much about the app, as my 10 year old son had been using it. He really enjoyed it at the time and completed his python certificate. It starts at beginners level, so it is very suitable for kids. The app is well structured and easy to use"
A Google user,4,great app for slow learner
A Google user,5,It's a great experience but the only problem I had faced is recently I had uninstalled Mimo by mistake and when I re downloaded it and login my Google account it showed me full stack developer course but I was in python ai devlopment it had completed its 33% now what can I do please help(edit- now it's working)
A Google user,5,really appreciate this one 😀 it's a great app for learning
A Google user,5,so far so good
A Google user,4,it's great to learn coding at this platform...
A Google user,5,BEST EVER!?
A Google user,5,good
A Google user,5,Appreciated UI and UX design Powered by their beginners friendly curriculum.
A Google user,5,fun
A Google user,2,"The app continues to get worse as it goes, losing your progress and streak randomly despite doing lessons wouldn't be as annoying if the practice area of the app didn't also completely populate itself with skills and lessons that you haven't covered, and the actual lessons continue to do less to explain what and WHY you're doing what you're doing as you go, making it nearly pointless at times because you don't know when to use what you're learning."
A Google user,5,wow
A Google user,5,it's very helpful for beginners
A Google user,5,Thank you
A Google user,5,love the app😍🥰
A Google user,5,it is a best app for coding
A Google user,5,Learning code is SO much easier with this
A Google user,5,best app for coding
A Google user,4,It would be good to add a 2×1 widget to tell us wether we have practised or not like Duolingo. Please make the widget. Otherwise it is the best coding app to learn coding.
A Google user,5,"This app is amazing for beginners wanting to learn coding for Web Development. I've learned so much valuable information in just my first week of studying. There are plenty of exercises to practice a newly introduced concept each time. The free version is packed with such great information, that I'm willing and confident in purchasing the paid version for additional content."
A Google user,1,"Poor Customer Service and Lack of Transparency. I asked Mimo simple questions about their subscription: Will I get a free trial with Max(if i buy on monthly basis)? If I buy MAX in mid of month, how long will the subscription last (till the end of month or for next 30 days) ? What are the cancellation fees? Instead of clear answers, I got unhelpful links. This lack of transparency is frustrating. I can't recommend Mimo until they improve their customer service."
A Google user,5,coding is hard
A Google user,5,best of the best
A Google user,5,it's very good and helpful for children
A Google user,5,excellent app
A Google user,5,good 😊
A Google user,5,this app is very good for beginners who are learning coding. I would recommend it for everyone
A Google user,5,we can learn coding in a fun and relaxing manner
A Google user,4,amazing app with the best knowledge that get you learn 👏 🙌
A Google user,5,nice
A Google user,4,"This will take time but You will learn many things, give 10 min daily in this is better to waste 2hr on Instagram"
A Google user,5,nice app
A Google user,5,Very simple education tips. am very intersted.
A Google user,3,"Mimo is truly a career building tool, with simple UI and modular tutorials planned to suite learners and integrated environments to fasten learning and coding skills,, however most of this are locked behind the max,,,not even pro members get access to this,,, quite unsatisfying"
A Google user,5,Amazing
A Google user,5,I wish change the difficulty a bit.
A Google user,1,"I thought the app was nice, saw the web app, and thought I'd buy pro so I could make progress on both. Found out pro unlocks nothing on the web app, and my progress that I made on the free android version is locked on the web app even with pro. Stupid design"
A Google user,4,"Nice format. The app is missing the ability to test out of units that the learner already has a good grasp of. It could be my phone settings, but it seems like the editor aggressively selects text when I try to place the text cursor, specifically if nothing in the text editor window had already been selected. It takes 3-4 taps to get the cursor where I want it to go. Heaven help you if you are trying to add a line below the top line. Gets frustrating after a while."
A Google user,5,Where's termux🗿
A Google user,4,add the Ukrainian language pls🙏
A Google user,5,"brilliant I think I am getting better at Python ever since I wanted to learn how to code, and I love this app because it is so amazing to learn with. The developer is really helpful."
A Google user,5,Easy to learn
A Google user,5,very interactive
A Google user,5,I like the way how they teach
A Google user,4,GOOD VERYY NICE 🙂🙂🙂🙂 ⭐⭐⭐⭐
A Google user,5,best coding learning app..
A Google user,5,Great app to learn coding for starters👍. print(Yes)
A Google user,5,very good application for learning codein in phone
A Google user,5,it's great and I learned code and its way more like a breeze
A Google user,4,great educational app🏆
A Google user,4,it helps a lot in understanding coding
A Google user,5,It really help you in growing with fun. Thank you mimo.
A Google user,5,very good app for learning coding as a game developer
A Google user,5,I love this
