userName,score,content
A Google user,5,nice
A Google user,3,it's really helpful application. We can enhance our skills in very smooth way.
A Google user,4,Ok
A Google user,4,"So far, I'm captivated. Seems like a great place to begin learning. I need to do it longer before my final judgment."
A Google user,5,I even just did not know anything about html coding etc.. . But after using mimo I have learnt also so much about coding and coding. Thank you Mimo
A Google user,5,it's the best ai app for the greatest learning thanks
A Google user,5,My experience with it has been very good and I am enjoying it.
A Google user,4,"Am so happy I found these app, it helped me so well and so fast😇😊 Thank you very much 🙏😊"
A Google user,4,"Its great but i hope It just Doesnt need payment for the Time Usage , just like duolingo it just Needs to have in app purchases to its other offers not the total.usage itself"
A Google user,5,Great learning app
A Google user,4,"It's good for me so far, I enjoy it."
A Google user,5,good app for coding
A Google user,5,"good job making an app to learn coding. the UI is simple, I can directly go to the language I want to learn, in my case JavaScript. overal nice app. keep up the good work"
A Google user,5,Very good
A Google user,5,Is very helpful to learn python for me. Highly recommended.
A Google user,5,"amazing app really helpful if you want to learn to code, try the app I am sure you will enjoy it just as I am doing"
A Google user,5,it is a brilliant platform to learn as a beginner
A Google user,5,This is fantastic am enjoying coding Mimo is the best
A Google user,5,"Very Helpful for Beginners, especially for kids to get familiarised with the whole coding world. A kid can simply become one good python coding expert at a very young age with the help of this application. Love it"
A Google user,5,It would be good if the unlimited hearts wasn't a pro feature
A Google user,5,"it's good , learning programming is too easy like learning language in doulingo"
A Google user,5,Amazing
A Google user,5,I appreciate the who created this app definitely different from another app i learn alot of things 10qu
A Google user,5,it is best app for learning coding
A Google user,5,You excellent
A Google user,5,"Completely Impressive App, Nice Experience, I have a suggestion that pleased add some more projects of games, apps, software and add c sharp as well, So this app become full pkg of Professional programming,"
A Google user,5,"I love mimo, though i made mistakes in my answers it lets me try again to make it right.Super user friendly for zero knowledge of coding.Love this app.Highly recommend to try it."
A Google user,5,Fun to use!
A Google user,5,not bad
A Google user,5,This is a great app to learn how to code
A Google user,5,Good and fully interactive way to learn something useful.
A Google user,5,You need to try this for coding it's awesome. Comprehendible and flexibility...
A Google user,5,this is the best HTML self tutorial app I've come across on the internet. best app ever
A Google user,5,Nice app for learning web development
A Google user,5,Mimo is the Game Changer..! Such a nice app ❤️‍🔥
A Google user,5,I love how it's simple which makes it x5 easier to understand.
A Google user,4,A good app for beginners.I have learned html Style css and java but the thing which is mising more test and practical exercises for learners .And please it gives some glitch in making account please let it fix.Some times it not give information about ol and li tags.plese solve it in latest updates.pleeeeseeeeeeeeeeeeeeee
A Google user,5,Absolutely amazing!😍 I finally understand Python and coding.
A Google user,5,So good
A Google user,5,good
A Google user,4,it's is similar like Duolingo it instruct the coding language step by step it is really helpful and knowledge for us I agree if u can download this you definitely gain a new chapter of knowledge...................🥰
A Google user,5,very effective and easy to use app.
A Google user,5,I like this aap. I can understand this very easily because of this app. You should also try this app if you are beginner or want a job.
A Google user,5,"I loved app, because this app is best for beginners it explains each and everything in detail."
A Google user,4,Superbe application pour avoir une base sur la programmation mais le livre sur les différents langages de programmation a un contenu peu consistant par rapport au lesson donnée .
A Google user,5,Who needs school for this?
A Google user,5,good
A Google user,5,amazing great application for learning coding
A Google user,5,it's perfect in every way 🤩💞 . Kudos to Mimo
A Google user,5,that's agreet app
A Google user,5,Super app its useful
A Google user,4,good
A Google user,5,"Hi Supernintendo Chalmers, I'm learnding"
A Google user,5,"Para aperfeiçoamento no ramo de Java Scrip, HTML, entre outros é fenomenal."
A Google user,5,"Have been willing to learn and developed my skills on coding, it's such a opportunity having an application like this it makes learning so easy. I want to say thank you to the builder"
A Google user,5,it is a very good app though u should make notes with it
A Google user,5,great
A Google user,1,with the free subscription they won't even teach you the bare minimum requires
A Google user,5,it's the best
A Google user,5,Literally gave me a starting point. Still use it today for fun
A Google user,5,it's awesome
A Google user,5,| Love it 😀
A Google user,4,other then having to subscribe and unsubscribe from the pro version it's pretty decent
A Google user,5,absolutely Fantastic
A Google user,4,good app for learning
A Google user,5,I love your work
A Google user,5,"Learning to code from the basics , it became simple with this app. Thanks to developers."
A Google user,5,Mimo app is more useful to learn programming languages in an easy way and easy to develop our programming knowledge ✨💯💯
A Google user,5,i love mimo. it's a great way to augment and reinforce lessons from coding classes. the only downside is that the web browser bars version of the app is difficult to use and limited in function.
A Google user,5,"This is a great app! It has easy language, its design is attractive and it makes learning coding like a game!👍👍"
A Google user,5,"This is the best app to learn coding.......😊 It teach programming languages like a fun games......😁 This gives certificate for the languages.....🥰 And many languages are taught in this app whatever it is like JAVA , HTML , CSS , REACT...ETC... It is used also to make own portfolio...... I suggest you to programm by using this app.....👍🏻"
A Google user,4,good
A Google user,5,"I'm a total beginner, and I feel understood in the way the lessons progress, it becomes so easy to navigate and understand how it programming and coding really works. Amazing app definite recommend."
A Google user,5,"I love this app! as a person with ADHD who tends to lose motivation, mimo makes the learning process fun! by repeating questions I can answer I feel more accomplishment and energy to want to do more!"
A Google user,5,amazing learner
A Google user,5,good
A Google user,5,mimo app is best code learning application
A Google user,5,"Great for learning how to code in your downtime. Easy to understand, and Mimo breaks down the content in small bytes that add up to gigs of knowledge."
A Google user,5,very good and good appearance
A Google user,3,I am facing problem logging the account in my laptop. I am able to login but I don't see it being upgraded to Pro. Can someone help?
A Google user,4,It is designed like a game..... easy to understand... the codes are amazingly easy to understand.... very good for beginners
A Google user,5,very easy to navigate so far
A Google user,5,This coding app is super good. I had a practical exam in Computers in my school about HTML. Before the chapter even started i started learning HTML from here. I got the most marks in computers just because of this app. Very recommended!
A Google user,5,i enjoy this app since i can learn coding using my phone
A Google user,5,I'm enjoying this so far.
A Google user,3,great app
A Google user,1,"The first time I played, I noticed how the game was delayed in refreshing my progress. I got used to it and made it to the 3rd level. I opened it up the next day and it had not saved my progress, which is a dealbreaker."
A Google user,5,"es muy buena, explica conceptos basicos y avanzados de una forma sencilla"
A Google user,4,May make tasks faster
A Google user,5,easy to learn but can't afford vip
A Google user,3,doesn't give enough details of what things mean. Very confusing to understand what I'm doing.
A Google user,5,i like the app more than you think cause now I am what I have never imagined thanks for all I got keep it up
A Google user,5,Easy understandable app
A Google user,5,Great for learners that need to be easily taught.
A Google user,4,it's good app
A Google user,5,I love this app. I just started today but I have already learned something plus I just got to chapter 3 😄😄😄😄😀😀😀😊😊😍🥰😁😀
A Google user,5,the best
A Google user,5,very good one for studying
A Google user,5,made me a new person
A Google user,4,I think it's quiet useful for beginners like us. I suggest to just try.
A Google user,5,it's very nice and very useful for me 😊😊
A Google user,4,"Its a good appo to progress with any programming language. But it is not organised properly, and still requires a lot of bug fixing. For example, while learning something we often get skipped from step1 to step4. As a result we don't know whats in between (step2&step3). This leads to a confusion."
A Google user,4,Just started
A Google user,5,it's nice for beginners to learn python. I suggest everyone to use this app. I like it ☺️.
A Google user,3,it is very useful app and it has noporblem
A Google user,5,This 1st session has been enjoyable.
A Google user,4,"Mimo is great for learning code, but what I don't like is you have to spend coins just to get hearts back. So if you get 5 questions wrong you have to spend coins and if your out. Your done for the amount of hours until it gives you more hearts. Overall it's a pretty good app for beginners."
A Google user,5,"Please add courses related to finance power Bi and Excel, etc Otherwise, it's a great app for learning coding"
A Google user,5,It's a super easy app to learn new programming languages
A Google user,5,Great app
A Google user,4,good for beginners who want to learn coding genuinely
A Google user,5,this app is very good 👍 I just started using it but it the best
A Google user,4,I love this app but it annoys me when it doesn't save progress when connection has issues
A Google user,5,"great tool to start, very simple and easy to understand"
A Google user,5,nice apps
A Google user,5,good stuff
A Google user,5,ferry 👍
A Google user,5,"Highly recommend this app, as it taught me a lot about programming and I was able to be ahead of CAT class this year with HTML. Thank you Mimo"
A Google user,5,this app teaches you coding in the simplest way to understand.
A Google user,4,wow Mimi is a great app for an idea person to learn HTML fast.
A Google user,5,best learning app it's like duolingo it supports us when we get wrong in the questions it's the best coding app I've ever seen
A Google user,5,this app increases your skills
A Google user,5,It's such an amazing app to learn a coding thank you so much developer's 🙏 be continue and add other programming languages
A Google user,5,I love it
A Google user,5,this is a great learning app
A Google user,3,slow
A Google user,1,"There is no message option to talk to my friends on my Mimo account, Please add a messaging option to this app."
A Google user,5,It is a great app that makes coding effortlessly easy to learn 👌
A Google user,5,it's good mimo app nice 👍🙂
A Google user,5,Great 👍🏻
A Google user,5,good and simple
A Google user,5,"I like it! Mimo does a great job at explaining the terms and functions in a simple, concise but very effective manner. I hope to build my website soon with what I'm learning!"
A Google user,4,great 👍
A Google user,5,Like Duolingo but better and coding!
A Google user,5,great app
A Google user,5,helping me in coding
A Google user,4,fair enough
A Google user,1,"app is good, but it doesn't sync well on desktop and they don't respond to support emails"
A Google user,5,it's very easy too understand and real! plus it not so bad tons of fun for all ages! Way to go guys you hit this one a home run; even grand slam!
A Google user,4,nice
A Google user,5,This app help me to know more ideas about coding and correct selection of the properties.
A Google user,3,its so good
A Google user,5,gorgeous 💯👌
A Google user,5,best app for a newly introduced character to coding
A Google user,5,verii gud
A Google user,5,"very easy to learn, fully recommend"
A Google user,4,Pretty neat and organized.
A Google user,5,the best app
A Google user,5,I love it
A Google user,5,I have been showing interest to learn coding lately. I feel like for any person that is new to computer languages this is a great place to start your journey. the app provides you with a great friendly topics. great app I say
A Google user,5,I like this app
A Google user,5,this is quite helpful
A Google user,5,super easy to understand and follow
A Google user,5,This is a very good good good 😊👍👍👍👍 app for lerning pograming like this app download this app
A Google user,3,understandable
A Google user,5,it's a really great app to learn coding it's like duolingo it's helpful and really encouraging
A Google user,3,the logo is so cute
A Google user,4,"Great app to learn coding html, and but too expensive the pro"
A Google user,5,This is the best coding app i have ever used. Very less ads. More knowledge. This is worth it!
A Google user,2,It requires hearts to continue progress or we need to buy the subscription. This restricts and makes you lose interest in the course.
A Google user,5,Great 👌 lessons
A Google user,2,the try max for free is not clickable
A Google user,5,WOW I'm 38 and have never coded in my life! I feel very confident that I will be coding within a month or less!
A Google user,5,love how it's free and I'm okay to watch an add or two plus it has the perfect amount of lives and doesn't. move too fast
A Google user,5,it kind of nice
A Google user,5,superb
A Google user,3,"Makes the learning process a hands-on experience, ensuring you practice to retain as you learn."
A Google user,5,This app is very helpful
A Google user,4,The app is funny and excited 😆 please add flutter frame work And dart Programming Language
A Google user,5,I'm currently learning coding through college but this is useful in my spare time and when I'm away from my computer
A Google user,5,"Interactive, insightful and engaging."
A Google user,5,Lovely! Great tool for beginners 💗
A Google user,5,it is an very helpful app for learning basic coding
A Google user,2,"Fica calculando sparks por bastante tempo, depois da erro e tenho que refazer o mesmo exercício"
A Google user,5,best app
A Google user,5,really help on understanding basic concept of coding
A Google user,5,for beginners who doesn't know anything about coding it is good
A Google user,1,In Iran we can't use it.
A Google user,4,very good app for learning
A Google user,5,it's fun and easy
A Google user,5,"need code, eat code, dream code, love code"
A Google user,1,It's just one long ad.
A Google user,1,"I want to opt out from a leader board - if you add this feature - I'll give you 5 star. Also it's not possible to change email address of your account. Competition is a thief of joy. I'm also perfectionist. If I'm competing I want to be number 1, always. Bronze medal or silver medal is a humiliation for me. I want to learn at my own pace. When I do tasks a little harder, I'm accidentally shooting up on the leader board. I don't want to compete"
A Google user,3,"Previously I was using the app to learn Front End and it was great, but now I redownloaded to learn Python and have no way to find any button to change the path, it only allows me to continue with the front end path. Please fix it otherwise it's not useful for me anymore."
A Google user,5,its great way to learn with fun.... prefer mimo now instead of instgram
A Google user,4,good to beginners.
A Google user,4,it's so beneficial
A Google user,5,very good 👍
A Google user,5,Good
A Google user,5,this app is very good for beginners to learn python fast
A Google user,5,"very nice app, I love it 😍💖"
A Google user,5,so far so good
A Google user,5,V good
A Google user,5,It is very easy to use and comprehend. I am happy with my experience so far
A Google user,5,à real experience and a half
A Google user,5,It's really useful for learning
A Google user,5,"this is the second code learning app I've downloaded and now I'm kicking myself for paying for the first one. Similar feel of ease to Duolingo , simple, and I'm loving the free trial. amazing so far!"
A Google user,5,Great App for learning and very helpful.
A Google user,5,This Is the best app
A Google user,5,I think this is fun and creative and ez way to learn code
A Google user,5,"I got a degree in this a while ago but haven't been practicing enough... this is great as a reminder, and super simple to start. I haven't paid into it at all yet"
A Google user,1,Great way to learn. Really helpful to have a place where you can practice and experiment with the coding you've learnt in the lessons.
A Google user,5,❤️
A Google user,5,"Two words, ""best app""🤯🤯🤯"
A Google user,5,This is a great learn along app.
A Google user,5,"pretty good. I'm taking cybersecurity, and it's great practice"
A Google user,4,it's cute and useful 😌
A Google user,5,Great app
A Google user,5,coding is fun
A Google user,4,very good app to learn coding
A Google user,5,best app( ˘ ³˘)♥
A Google user,5,"Perfection 🥶🥶🥰 Ok for my practical exam you helped me, and now I'm learning python for making games but I should learn java for another practical 🙃. Thanks that I found this app, god bless you all !✅"
A Google user,5,it's a good app for coding
A Google user,5,the most lovely learning application ever
A Google user,5,Great to learn new skills training and development
A Google user,5,it's educative
A Google user,5,very helpful and fun...I love it🥹💓
A Google user,5,"It is a very good app for coding . It lets you select what you like or what you want to do after so many choices , it suggest you which course is best for you accordingly to your interest. There are literally so many options you can go for. Just an amazing app. You can also choose the other courses if yours is complete ✅ and give you a amazing certificate to make your resume more powerful."
A Google user,5,FROM THE FIRST DAY I STARTED USING IT FOR LIKE 30 MIN/EACH DAY AND NOW I AM PROGRESSING AT A FAST PACE. THE BEST THING ABOUT THIS APP IS THAT WE CAN CHECK OUR PROGRESS AND EXPLORE THE CODING WE ALREADY DID. BTW IT WOULD BE MORE GOOD IF THERE WAS NO HEART SYSTEM WHICH LETS YOU DO MISTAKE ONLY 5 TIMES AND THEN FORCES YOU TO TAKE A BREAK. :)
A Google user,3,"Lost interest before the second lesson. May be great, but it's boring."
A Google user,5,Awesome! Easy to understand and there's practice right after. Love it!
A Google user,1,February 2024: The the streak lossbug is still present November 2024: This bug is still present. There's no proper support. There's a percisting bug where the daily streak is added but then ot is not properly registered into the database. I lost 250 days streak because of this and I'm not coming back! This is a developer training app full of bugs for petes sake! And don't you mention streak repair once a month when the bug happens two days in a row! I want my money back but there's no support.
A Google user,5,it's very amazing 🤩...
A Google user,5,great app to learn code!
A Google user,5,Very great!
A Google user,4,good
A Google user,5,One of my favorite learning methods I've ever found ever!!! It's like duolingo but for learning programming.
A Google user,5,it's very useful and working so simple to practice any computer language .
A Google user,3,I am still studying but it's amazing
A Google user,4,user friendly and educative
A Google user,5,"This app makes learning code understandable and fun. So far, so good."
A Google user,4,"This is a wonderful app for learning and practicing coding. It will be helpful if you add some other programming languages like java , c++, swift etc and also add some more new features in regarding practice problems and filling the hearts."
A Google user,5,"If there were more stars to rate this app, I'd add them all. Exceptional learning tool. ❤️"
A Google user,5,A great learning tool.
A Google user,5,It's the best app I can find for coding. And it's amazing y'all should try it
A Google user,5,"Great app 👌, it makes it easy to understand the concepts."
A Google user,5,"I had a good experience. It's easy to use, learn and understand concepts"
A Google user,5,"haven't actually used it yet, it, in a real easy, simple way,(and I'm a big dummy when it comes to this computer type of stuff LOL) teaches you how to use it , by teaching you variables etc. etc. I may change my stars when I get into the app and actually use it but so far so good and I hope I don't have to"
A Google user,5,it is nice app
A Google user,5,Best app ever
A Google user,5,The app's theme and presentation is so cool and it seems that the developers of this app are well experienced. They know how can the things looks easy for beginners. That's great!
A Google user,5,excellent
A Google user,5,"this is quite engagement and fun to learn with, lots of love mimo team , U guys did wonders , is so easy to understand"
A Google user,4,You guys should consider giving pionts for a reviewed lesson... Also I didn't get my free mimo pro after I invited someone...
A Google user,5,we learn a lot of things in this application
A Google user,5,good
A Google user,5,"I'm learning python on it and it's truly good and easy to understand ,if your a bignner just like then this app is perfect for you"
A Google user,5,very interesting to learn with
A Google user,1,"Mimo is a great tool for absolute beginners. I downloaded it for the clear roadmap (as advertised), but I was disappointed when I ended up with only basic lessons even though I selected that I knew a lot, yet the app forced me to start from scratch. Perhaps, a diagnostic test to place users at the right level would be very helpful."
A Google user,5,I am learning a lot from this app....I definitely recommend it for anyone who wants to do coding(currently I'm learning Python)
A Google user,5,veryy nice
A Google user,5,This is great. The way the lessons are setup is fantastic. How I wish I had known this app for long. And thank you for making it free.
A Google user,4,good app
A Google user,5,Very interesting and easy to learn love it
A Google user,5,love it so far. I am just learning the basics for now.
A Google user,5,This is very very nice platform for learn cording infact you car try by mat site
A Google user,4,Want to improve GUI
A Google user,5,Awesome app for learning to code on the go!
A Google user,5,No ads its just teach you and nothing else in between
A Google user,5,"So far, I like this App. Helping me to learn coding in easy way and also fun."
A Google user,1,It's too difficult to learn. Like actually.
A Google user,4,User friendly and very helpful in learning how to code
A Google user,5,great application it teaches of coding things for free I thank you for such an app
A Google user,5,best learning app
A Google user,5,"Very, very great app. Try it out, u will never regret it ✌️😉😁😁😁🥰"
A Google user,5,"Really helpful app. I'm loving it, keep up the good work"
A Google user,5,Great app and totally free best for beginners and very well explained
A Google user,1,"I promise I will give it a try, but the format makes it REALLY hard to get motivated. I don't want Duo Lingo style fill in the blank. It requires no effort or thought, and teachers nothing."
A Google user,5,I'm having a blast on this
A Google user,5,I really love this app
A Google user,4,"I don't like the color of python code in practice, the previous one were better and helpful the track the code syntax,"
A Google user,3,it's good but for fun of course
A Google user,5,very nice app
A Google user,5,Nice app
A Google user,5,"am just happy and overwhelming, this app just give me hope and courage to continue my coding practice. God bless you guys."
A Google user,3,"I actually really like this app! I learn quickly, it's addicting and fun! However, I wish they changed some stuff in the mobile app, specifically the code editor. If I hold in the ""delete"" key on my phone-keyboard in their code editor, it will suddenly hop to the top of the file after 3-15 letters have been deleted. This drives me insane!! I also wish I could have the option to tap on a certain location in the code without selecting a block of code, because it makes it so hard to code on mobile."
A Google user,5,"Good platform for Beginners like myself, to learn from scratch 👍. Highly recommend"
A Google user,4,"good,🤩🙈 i can't deny it"
A Google user,5,so far this simple and fun to use
A Google user,5,I usually don't write reviews but this is the best application i have came across so far. It's easy to learn from basics to adavanced.
A Google user,5,learning well and i am loving the simplifying
A Google user,5,its an app that is helpful for begginers specially if your new to coding. I definitely 100% recommend this if you want to learn coding. hope it helps..
A Google user,5,I'm enjoying learning with Mimo App
A Google user,5,good app
A Google user,4,usefull
