userName,score,content
A Google user,5,"fire UI, super responsive, repetitive in a good way to solidify knowledge. Excellent app for beginners"
A Google user,5,Simple and Understanding.
A Google user,5,Nice!
A Google user,3,"As many others already mentioned, the code editor is very inconvenient. Also, if you're using your phone's auto completion, it loses random letters from the words. When the task in practice has several solutions, it will accept only the hardcoded one, the rest will be rejected even if they are correct."
A Google user,5,Very Good hehe
A Google user,4,"The concept and execution of this app is flawless. I do have a petition for something that I think the app should do: when I switch from front end developer route to full stack, I have to retake the same exact courses, the progress should be global imo, since they're the same exact content :-)"
A Google user,5,Great app
A Google user,4,this app is very nice to learning. it's obviously good for learning. thank you mimo app for learning coding to me 💯
A Google user,5,I have wanted to learn code for a while and didn't know where to start. Someone mentioned how this app is like Duolingo but for coding and that's so true! The app is so easy to use and it makes coding seem easy. I definitely recommend this app!
A Google user,5,Perfect for beginners in coding.
A Google user,5,"Just like an interactive, fun app to learn coding wether if you are a beginner or an intermediate. ⭐⭐⭐⭐⭐"
A Google user,4,wonderful app
A Google user,3,good practice App
A Google user,5,so far so good
A Google user,5,Very Good
A Google user,5,very good 👍👍👍😊
A Google user,4,Educative and interesting app
A Google user,3,good for leaern code and it have lot of fun..
A Google user,5,"muito bom, eu estou usando e recomendo"
A Google user,4,awesome thanks for bringing it up
A Google user,5,Great app to learn coding 💯
A Google user,1,"This is not a free course oe app, you get very few lessons for free."
A Google user,2,"Thought this would be a good way to learn but things like the heart mechanic really gets in the way and stunts the learning prosses ( especially if ur new). I recommend everyone should go on a browser and search for ""W3Schools"". It's WAY better then this and you can learn what you want at any time totally free."
A Google user,5,good starter for those who want to learn code. It walks you through the coding step by step 👍
A Google user,4,"It's Great app for beginners for learning code as a student for me. It kind a of resembles to ""DUOLINGO APP"" which is quite fun to play with ....! But only issue is Advertisement...over all its good 😊👍"
A Google user,5,Good but add java
A Google user,3,not good but not bad
A Google user,5,"I made a post about this and recommended this on LinkedIn. This app is great for anyone who is looking because they are curious about coding, and when they see it, they just see a bunch of gibberish. More seasoned devs may get a little bored, but as someone who works using React.js, these front-end basics are actually quite fun due to the set up of the app feeling like a game. This app is better than your ""just to kill time"" app and can set you up for discovering or improving your tech career."
A Google user,1,"The Mimo platform claims to be an educational tool for learning programming, but it is nothing more than a greedy, disrespectful scam. You’re forced to buy two separate subscriptions—one for the mobile app and another for the website, which is necessary for accessing exercises. This anti-user approach demonstrates unnecessary greed, causing confusion and frustration while ignoring users’ real needs. Don’t waste your time or money on this app."
A Google user,4,so far with my journey of coding with Mimo has been wonderful
A Google user,5,one of the coolest programming app!
A Google user,5,very important apk to learning html
A Google user,5,I like this it is like doingo except it's for robotics and coding
A Google user,5,very intuitive and friendly at the moment of coding. I'm still learning of this Wonderful tool.
A Google user,5,Nice one
A Google user,5,fun
A Google user,5,easy to learn and work with
A Google user,3,"This app is awesome, but I wish it was more like a combination of Finch and Duo: you get a little character to motivate you to continue every day and spend your points on to clothe and house (Finch) and you get a home screen widget to see your daily streak (Duolingo). I often forget about Mimo but I never forget about Duolingo because of that widget pestering me politely to practice everyday. I REALLY WANT A DAILY STREAK WIDGET!!! 😭 Plus it also need to be more like the others with more audio."
A Google user,5,I have never seen an app as good as this
A Google user,5,it's very educational and easy to follow along! loving the learning experience so far!
A Google user,5,I like this app. it's very simple to use
A Google user,5,"So Far, I'm enjoying it. It's very helpful."
A Google user,5,easy
A Google user,5,this app is supper useful.
A Google user,3,does it have c#?
A Google user,4,It's really great and overall the app motivates u to continue learning.. I have to say it's a really nice app.
A Google user,5,good application 😃
A Google user,1,Some tags are missing in html curriculum
A Google user,5,good app
A Google user,5,Mino is the best way to learn python and all other kind of computer science try mimo for the great achievement 🤫😉💪👍
A Google user,5,👌🏾
A Google user,5,its easy and useful i love it
A Google user,5,"it's a very simple yet very effective app that helps you understand python. Give it a try, no ads just coding. I love it, with beginner friendly lessons and also good for experts if they want to refine their skills"
A Google user,5,Great one
A Google user,5,Great 👍
A Google user,1,"The app Is ok, but I couldn't find any place to cancel my subscription, I decided to delete the account, but I was still charged for the year , pls fix this problem"
A Google user,5,An amazing platform to learn code.
A Google user,5,Awesome app
A Google user,5,nice but not free
A Google user,5,best learning for beginners 😜
A Google user,5,Good app
A Google user,4,"it doesn't count ""xp""s at midnight"
A Google user,5,amazing!
A Google user,5,The App is well put together and self taught
A Google user,4,"so far, it's a good learning computer coding."
A Google user,5,For a beginner Mimo is the one
A Google user,5,very interesting and fun for learning
A Google user,5,It make me learn the coding in a fun way
A Google user,5,love the simplicity and straightforward approach. learning is fun
A Google user,5,it's really helpful
A Google user,5,Great app.. loved the interface . Daily challenges were really needed.. I enjoyed coding on Mimo.😊
A Google user,5,"cool app, I've learnt from it in only 2min"
A Google user,5,this application is to be best for a beginner. it's too easy to learn a programming languages
A Google user,5,very nice
A Google user,5,Very good app to help you learn
A Google user,5,"The app overall is very cute and good, also it's user friendly and very helpful."
A Google user,5,Avery easy and funny learning app I ever seen
A Google user,4,good
A Google user,4,"It's a great app, but can get a bit buggy when typing in code. Example, it might reset suddenly at the top while writing something in the ide."
A Google user,5,"This app is amazing, I never thought I was going to be able to use coding but with this app it is a breeze"
A Google user,5,very educational and helpful for learning code.
A Google user,5,Great app for learning coding from scratch!
A Google user,5,easy on start ❤️ I hope I'll write report when I get to the end
A Google user,5,"I enjoy this app very much. I am not only learning, I am having fun as well."
A Google user,5,cool
A Google user,5,starting so far but it's easy to use
A Google user,5,"Step by step, easily understandable short lessons with guided practice, makes it easy to learn coding. Free version is more than adequate for making regular progress"
A Google user,4,"a very great app, it's made my learning su simple"
A Google user,5,this app is simply amazing and quiet educating
A Google user,5,"So user-friendly and entertaining, yet my skills are improving at fast rate"
A Google user,5,"it's easy and straightforward so far. coming from zero python experience, this seems easy to process"
A Google user,5,j'apprecie cette app est meilleure que je n'ai jamais vu
A Google user,5,good helpful
A Google user,5,From experience
A Google user,5,very good app
A Google user,5,it's not just a game it's education
A Google user,5,Its good
A Google user,4,I like that it breaks down what words to write into the syntax.
A Google user,5,very good for beginners
A Google user,5,"Right from the first lesson, even at its basics, it teaches something ""value""-able :D"
A Google user,5,makes learning so much fun on how to code. ✅
A Google user,5,fun way to learn
A Google user,5,"Great, I guess"
A Google user,5,absolutely insane! you don't need to waste your fees on universities just dive in here with #Mimo Step by step am get fully into the class of coding with Mimo and it's just matter of giving your time learn easily with this app.
A Google user,5,simple and Good
A Google user,4,"Mimo is an incredible app to learn programming, you can learn a lot even on the free plan."
A Google user,5,ഹ്ഹ്ഹ്ഹ്ഹ്
A Google user,1,Is there any chance to return? I just wanna use it for trial. And I thought it will be noticed (and it was shown in the first time tutorial). But it didn't and then charged.
A Google user,5,Very good and recommended beginners
A Google user,5,learning with Mimo looks very easy and exciting!
A Google user,5,good 👍🏻
A Google user,5,It's a wonderful app to learn coding. gives you a feeling of playing a game.
A Google user,5,I think this is??????????
A Google user,1,"Did not order but still being charged $63.59. I purchased a new phone, and turned my old phone to factory reset. However, the day I saw I was subscribed for this, i canceled it. Ivan canceled I even canceled the day prior to the payment date, which was about a week after i was hacked. I've tried to submit for a return on this invalid purchase with NO LUCK! They ARE SCAMMERS - and they WILL rip you off. Guess I'll be taking them to small claims court, where I'll win by default (no lawyers)."
A Google user,5,very easy to understanding
A Google user,5,The best app ever 👊🤓
A Google user,3,"So far, so good"
A Google user,5,"from my end, learning is going on well"
A Google user,5,perfect
A Google user,4,"it's an awesome learning platform,I may say.i love it and been using it since grade 10"
A Google user,4,Nice place to learn coding. Very easy and simple
A Google user,5,i am learning html cool 😎 amazing 😍
A Google user,4,simple and easy to understand complex syntax
A Google user,5,very good for coding
A Google user,5,"Très intéressant et Pratiques je recommande pour toute personne voulant aprendre a codé. Les exercices son plutôt simple a comprends et a retenir, il est facile de réviser n'importe où et a n'importe quel moment et ça j'aime bien. J'ai fait seulment quelques exercices et j'ai déjà apris des choses, c'est vraiment cool 😁"
A Google user,5,its a great app.highly recommended for beginners 🔥
A Google user,5,Good Learning platform
A Google user,5,"Very nice app, I am learning now."
A Google user,4,This is the best app. Complete the question and start the adds. I like this memo aap 🥰👍
A Google user,5,"You can't stop learning, it's great"
A Google user,5,Very fun way of learning
A Google user,5,nice application
A Google user,5,nica aap
A Google user,5,good
A Google user,5,Idk what to say 😅
A Google user,5,I learned like 50 scripts in one day I recommend this program very much
A Google user,4,supper
A Google user,5,"mimo is great,it simplifies coding I'm optimistic..."
A Google user,5,it's fun
A Google user,5,Simply amazing. Thanks.
A Google user,5,I'm loving this app the further I advance
A Google user,5,great app to learn
A Google user,5,This is my favorite teacher app of all time I LOVE THIS APP TOoo Much
A Google user,4,its good just like duolingo
A Google user,5,good
A Google user,5,real appreciated.
A Google user,5,NICE 👍
A Google user,5,good
A Google user,5,good programming
A Google user,4,it's an amazing app this is best for learning coding
A Google user,5,this aap is best for biggenerns
A Google user,5,great app!!!
A Google user,4,useful
A Google user,1,cannot unsubscribe
A Google user,5,It's a nice app helping me alot
A Google user,5,it's great app for beginners
A Google user,5,idk how but its so addicting bro and its so easy 😭 like fun but ur learning ya
A Google user,5,They sit around watching people they have no right too
A Google user,5,I love these free bite-sized programming courses
A Google user,5,Great app to learn programming skills. Makes it really easy.
A Google user,4,This is a good app!
A Google user,5,love it really great
A Google user,5,"it could have a free version with ads like duolingo .. its a great app, very easy to use and learn"
A Google user,3,"It's very good ,no issues but I would have liked one more feature, which is audio.I mean having a voice read aloud the text note is better than straining your eyes,this will boost learning and increase ux positively"
A Google user,5,"What an incredible app! Outstanding work, team. The learning curve is impressively fast, and the design is seamless. Hats off to the UI/UX designers and developers for delivering such a polished and user-friendly experience. Amazing job!"
A Google user,5,This app is really satisfying. Easy steps to follow. It's almost as if you are playing a game.
A Google user,4,awesome
A Google user,5,a very good and better app to learn coding
A Google user,5,Make learning coding easy
A Google user,5,Very useful for me to learn coding Bec I want to become a hacker.
A Google user,5,it's a really good way of learning coding
A Google user,5,the best for beginners it's just like Duolingo but for coding
A Google user,5,I've been learning for a day yet I've learnt so much
A Google user,5,I love this app!
A Google user,5,Superb easy taking well done
A Google user,5,Good
A Google user,5,perfect app for coding
A Google user,5,not bad at all
A Google user,5,I am happy
A Google user,5,This huart is limited so much 😭 unlimited
A Google user,5,Great app
A Google user,5,cool
A Google user,5,it is so skibidi it learned me so much in one day 🙃🙃🙃🙃🙃🙃🙃🙃
A Google user,4,Mimo is actually quite cool. It's fun and easy to use to learn Python. I also love the user interface. It makes coding 😊
A Google user,5,The mimo is an exciting platform for learning code
A Google user,5,I want to purchase a monthly package but I am facing some problem. Can you solve it? Please reply 🥺
A Google user,5,"Отлично учит только нужен мотивация! Там очень легко обеснает и быстро осваиваете! Советую это приложение скачать если хотите учить программирования Python,JS,CSS и другие!"
A Google user,5,good apo to learn coding❤️
A Google user,5,excellent for beginners
A Google user,5,Nice
A Google user,5,I love this app has all the right ingredients to motivate learners
A Google user,5,good
A Google user,5,"I love this app, it's so easy to learn code here and the interface is user-friendly"
A Google user,5,Amazing application for coding
A Google user,5,"a bit too stiff, not flexible/diverse enough to comfortably use to the fullest as it seems, but overall cool app, gg 🤜"
A Google user,5,the best
A Google user,5,very helpful
A Google user,5,fine
A Google user,5,Greeaaatttt app 💖
A Google user,4,good
A Google user,3,this is good
A Google user,5,good
A Google user,4,I like the level of coding
A Google user,5,great app
A Google user,5,"Great app easy to use, I highly recommend!"
A Google user,5,1 hr in and i already know about html
A Google user,5,it's easy to learn coding here
A Google user,5,This app is very for beginners
A Google user,5,this app is best for coding
A Google user,5,"Its the best app for coding, its very educative and its not complex to use"
A Google user,5,Really fun way of getting familiar with terminology on your phone instead of doom scrolling
A Google user,5,it is a good app to learn
A Google user,5,It's interesting for me a lot.
A Google user,5,I love this
A Google user,5,great app
A Google user,5,it's just like Duolingo but this teaches programming language
A Google user,4,this is really cool
A Google user,5,learning bit by bit I recommend it for you
A Google user,5,"great 👍 , best app ☺️"
A Google user,5,pretty good actually 👌
A Google user,5,incredible for beginners
A Google user,5,Learning coding with this app is so easy and fun. Really great for beginners.
A Google user,5,it's very helpfull because it can to remember all tags with fill game it is very helpfull guys good job
A Google user,5,best app for learn coding
A Google user,3,"It is so interesting that am learning coding from Mimo , am sure by the time finish my lessons I will able to develop something on my own.👍"
A Google user,5,Great application for beginners
A Google user,5,very interesting to learn
A Google user,4,"so far I'm impressed with the app, but I'll reserve add or not add the last 🌟 for later in my usage if I believe it deserves it."
A Google user,5,helped me so much
A Google user,5,it's a very good idea
A Google user,5,beautiful
A Google user,5,"one of the best apps I've touched. Genuinely helpful, and you don't need the subscription. While you do have limited wrong answers but it's very beginner friendly."
A Google user,5,It is very educative for everyone
A Google user,5,So good aap
A Google user,5,A really helpful way to learn coding!
A Google user,5,good
A Google user,5,It's funny to learn and memorizing the study
A Google user,5,nice app for learning code
A Google user,5,easy to follow!
A Google user,5,Learn FFFFFFREEEEE! ❤️ Learn at your own pace
A Google user,5,really nice app wish it would be free of cost 🙂
A Google user,5,python is so easy to learn now
A Google user,4,this is very helpful
A Google user,5,"It's a really awesome mobile application that helps you to learn more although the payment is quite high for someone like that who can't afford it. However, I have plans to buy a premium membership soon if I have some extra money 🤑. For now I stayed in a free trial of the app for 14 days."
A Google user,4,good
A Google user,5,great app for learning
A Google user,5,Great app so goooooood
A Google user,4,This app is really good for coding enthusiasts
A Google user,5,Very intuitive and easy to follow. Definite must for the beginner.
A Google user,5,This is an excellent application for those who are just starting out.
A Google user,5,"Ótimo app para aprender o básico da programação de forma divertida e simples, como um jogo mesmo. Além de sanar dúvidas na hora com a própria IA do app, sem fazer com que você saia do aplicativo."
A Google user,5,it's fun
A Google user,5,great
A Google user,5,"it one of best app easy to learn html ,come for this app is the best I love it an am ready to pay for premium"
A Google user,5,It's awesomely. I'm going to recommend this app for everyone.
A Google user,5,"Still very new, but so far it is working quite well!"
A Google user,4,It's Good App for Beginners in this field.
A Google user,5,Love it 😀 nice 👌 😁👍
A Google user,5,I like it
A Google user,1,"Préférer Sololearn en version complète pour moins de 50€. Mimo vous fait payer 30€ pour la version Pro qui est très limitée. Par exemple, les projets les plus importants ne peuvent pas être réalisés sur l'application ET l'application vous renvoie vers la version PC. Pour pouvoir réellement travailler il faut payer la version Max à plus de 200€. La version Pro n'est là que pour vous appâter. En plus, vous êtes continuellement harcelé par les propositions d'abonnement à la version Max. À fuir !!!"
A Google user,5,best
A Google user,5,Great
A Google user,5,You will never find something better than this for Android environment.
A Google user,2,"One of the reasons I ever subscribed was the streak repairing feature. But today I discovered that my streak is suddenly broken after 99 days, despite yesterday I've completed 4(!) assignments in a row and received XPs for them. But it was only half of the surprise. The second half was a notification, that I've lost my streak and won't be able to repair it! Excuse me? I had all my repairs unused! I feel deceived now, so I just canceled my subscription. Thank you."
A Google user,5,Love Mimo for how the lessons are designed. Really breaks down everything for beginners.
A Google user,5,It is the best website for coding
A Google user,5,10/10 fun
A Google user,5,best of one
A Google user,5,its nice I can really learn coding very fast
A Google user,5,love! so fun to learn.
A Google user,5,i love this app.. thank you
A Google user,5,Very efficient
A Google user,5,The app is nice and it's helping me alot as a beginner although I haven't gone far it is worth the effort.
A Google user,5,great
A Google user,5,"Great app, easy to learn, and good challenging. Thank you..."
A Google user,5,"this app is amazing,I learnt a lot"
A Google user,4,"Muy buena app, lástima que en pc solo esté en el idioma inglés"
A Google user,5,So far so good
A Google user,5,I am learning so much from this app. They will give you multiple choice answers or make you type the answer for the coding example they give. I really recommend this app to anyone wanted to learn coding. It's a very good experience for me.
A Google user,5,educative
A Google user,5,"That's a great app, easy to learn!"
A Google user,5,This app is very useful for students who want to learn different coding languages which can be useful in their studies and life and the main and important part of the app is that it is free so everyone can use this app .
A Google user,5,it's very helpful for students
A Google user,5,Great app to learn coding. enjoying every minute learning.
A Google user,3,"No idea, I wanted to learn C#. Which wasn't included here."
A Google user,5,BETTER APP LOVE THIS APP💝💝💝 BEST EDUCATION
A Google user,5,Great app. I can learn more fast than just watching course.
A Google user,4,great learning application.
A Google user,5,"I love how it gives you ""building block"" knowledge"
A Google user,5,This is a very good app for learning coding and the ads aren't very invading like other learning apps i highly recommend this app :3
A Google user,5,Verg nice and helpful
A Google user,5,this app is a very important app for learning coding by themselves...
A Google user,5,"Very easy to learn, very intuitive, like the Duolingo of languages. great tool"
A Google user,5,this ap is very useful and fun for me
A Google user,5,it's good
A Google user,5,awesome
A Google user,5,This app is great for htlm beginners get it and begin your htlm coding journey 💪🏿
A Google user,5,awesome teaching
A Google user,5,I love the app.
A Google user,4,"it's a well-prepared app for coding, but it would have been better if it didn't have a premium."
A Google user,5,Great App! Kindly minimise the pop-ups appearing while coding. They float all the time unnecessarily and are very distracting.
A Google user,5,Best
A Google user,5,great way to learn I like it
A Google user,5,"Para quem tem dificuldade para aprender, esse é o lugar certo, eu mesmo aprendi mais aqui em dois exercícios que em uma aula no meu curso"
A Google user,3,"I want to give you 5 starts but i give 3 stars because the streak function must be improved just like ""duolingo"" app it's really good and easy but I hope you slove this problem!!"
A Google user,3,"I already know some python and wanted something to help me jot down ideas and learn new things. The code writer seems ok, but you can't import anything and it's an old version. For learning it does seem fun, very similar to Duolingo. But there's no way to skip ahead, so despite telling the app that I am at an intermediate level, I have to go through the bare bone basics. I do think it's good if you're brand new, and need more of a dopamine hit to start, but it's not really for me."
A Google user,5,MIMO is wonderful and astonishing. You just want to continue non-stop. I found it very interesting app to learn. Kudos to the developer of this App.
A Google user,5,ITS ABSOLUTELY AMAZING IF YOU WANT TO LEARN CODING 🤩
A Google user,5,as being a beginner i hope for the best although app is working good and smoothly
A Google user,5,it's very good
A Google user,3,still in it
A Google user,5,A new fun ways to learn
A Google user,4,"Great for learning individual skills such as coding a like button into a website, but I'm not able to type the codes, I have to click and drag. I think typing is an important part of this learning process that we dont get access to in this app. The limited access to certain app functions unless you pay, but that's a given."
A Google user,5,Thank you so much
A Google user,5,Super fun and bay the start was it esy
A Google user,4,Nice
A Google user,5,This app very helpful for new developer&need support to promote this
A Google user,3,it easy to learn
A Google user,5,This Mimo app for coding is just great
A Google user,5,I am learning coding fast I alr am working a game on roblox
A Google user,5,Just started using the app few days ago and I'm having ideas about coding already.. so happy 😁
A Google user,4,it's super good and even interesting it feels like game and it also provides correct course for u based on ur interests . it also reviews the old information however u cn use it for free for only some topics but overall best for beginners 🎀
